Gene_set,Term,Overlap,P-value,Adjusted P-value,Old P-value,Old Adjusted P-value,Odds Ratio,Combined Score,Genes,cluster
GO_Biological_Process_2023,Regulation Of ERK1 And ERK2 Cascade (GO:0070372),2/244,0.3452607466801542,0.4439066743030554,0,0,1.6577837746668915,1.7629790407837798,APOE;MT3,9
GO_Biological_Process_2023,Positive Regulation Of Endothelial Cell Migration (GO:0010595),1/85,0.3475134368660721,0.4452943798245753,0,0,2.382876382876383,2.5185858334956643,SPARC,9
GO_Biological_Process_2023,Organelle Organization (GO:0006996),3/418,0.3479622749448867,0.4452943798245753,0,0,1.4521177493479072,1.532944380941326,CHCHD2;APOE;PPIA,9
GO_Biological_Process_2023,Positive Regulation Of DNA-binding Transcription Factor Activity (GO:0051091),2/246,0.3488933393220386,0.4454475425297656,0,0,1.6440281030444963,1.7311435435085258,RPS3;PPIA,9
GO_Biological_Process_2023,Negative Regulation Of Angiogenesis (GO:0016525),1/86,0.3507897886854045,0.4468296844275802,0,0,2.354723707664884,2.46673350535558,SPARC,9
GO_Biological_Process_2023,Glucose Homeostasis (GO:0042593),1/87,0.3540498524990138,0.4488992356165325,0,0,2.327225745830397,2.4163993335324085,RPS6,9
GO_Biological_Process_2023,Regulation Of Insulin Secretion (GO:0050796),1/87,0.3540498524990138,0.4488992356165325,0,0,2.327225745830397,2.4163993335324085,NNAT,9
GO_Biological_Process_2023,Negative Regulation Of Protein Kinase Activity (GO:0006469),1/88,0.3572937084833981,0.4519683086575705,0,0,2.3003599210495764,2.367523811703655,PPIA,9
GO_Biological_Process_2023,Positive Regulation Of DNA Repair (GO:0045739),1/89,0.3605214364245345,0.4550029163151022,0,0,2.2741046831955924,2.32005037808893,RPS3,9
GO_Biological_Process_2023,Positive Regulation Of MAP Kinase Activity (GO:0043406),1/91,0.3669288252624231,0.4620273510758493,0,0,2.22334455667789,2.2290972080359737,RPS3,9
GO_Biological_Process_2023,Positive Regulation Of Neuron Projection Development (GO:0010976),1/92,0.3701086437867988,0.4639033000889327,0,0,2.1988011988011986,2.185517547233266,APOE,9
GO_Biological_Process_2023,Positive Regulation Of Protein Catabolic Process (GO:0045732),1/92,0.3701086437867988,0.4639033000889327,0,0,2.1988011988011986,2.185517547233266,APOE,9
GO_Biological_Process_2023,Positive Regulation Of Cellular Component Biogenesis (GO:0044089),1/93,0.3732726494349856,0.4668033816396517,0,0,2.1747913921826965,2.143139832163484,RPS3,9
GO_Biological_Process_2023,Peptidyl-Lysine Modification (GO:0018205),1/94,0.3764209201158763,0.469670648053673,0,0,2.1512979254914737,2.101919815261755,NNAT,9
GO_Biological_Process_2023,Positive Regulation Of Epithelial Cell Migration (GO:0010634),1/95,0.3795535332169826,0.4725054189027743,0,0,2.1283043197936813,2.061815304518316,SPARC,9
GO_Biological_Process_2023,Regulation Of Protein Phosphorylation (GO:0001932),2/265,0.3830459538380301,0.4757742729798157,0,0,1.523783657949872,1.462223275246586,PPIA;MT3,9
GO_Biological_Process_2023,Positive Regulation Of Signal Transduction (GO:0009967),2/266,0.3848236425327292,0.476903340294511,0,0,1.517934446505875,1.4495820420264696,RPS3;MT3,9
GO_Biological_Process_2023,Regulation Of Defense Response (GO:0031347),1/97,0.3857720948428521,0.4770019821367698,0,0,2.083754208754209,1.9847936202473104,APOE,9
GO_Biological_Process_2023,MAPK Cascade (GO:0000165),1/98,0.3888581963975129,0.4786617709018713,0,0,2.062168072477351,1.947801335478516,MT3,9
GO_Biological_Process_2023,Positive Regulation Of Protein-Containing Complex Assembly (GO:0031334),1/98,0.3888581963975129,0.4786617709018713,0,0,2.062168072477351,1.947801335478516,RPS3,9
GO_Biological_Process_2023,Positive Regulation Of Apoptotic Process (GO:0043065),2/270,0.3919126384091085,0.4813423679789722,0,0,1.4949741090466038,1.400366653740391,RPS6;RPS3,9
GO_Biological_Process_2023,Response To UV (GO:0009411),1/100,0.394984420817951,0.4840322478327122,0,0,2.020304050607081,1.8766785261005492,RPL26,9
GO_Biological_Process_2023,Chemical Synaptic Transmission (GO:0007268),2/273,0.3972059124148234,0.4856704808813765,0,0,1.4781986595376158,1.3648215048179724,APOE;HCRT,9
GO_Biological_Process_2023,Protein Catabolic Process (GO:0030163),1/102,0.4010498423953424,0.4892808077223178,0,0,1.98009800980098,1.8091552855878603,APOE,9
GO_Biological_Process_2023,Positive Regulation Of Inflammatory Response (GO:0050729),1/104,0.4070550586365517,0.4955060469877315,0,0,1.9414533686378344,1.7449915352070269,RPS19,9
GO_Biological_Process_2023,Regulation Of Cellular Response To Stress (GO:0080135),1/107,0.4159512905205901,0.5052151736632832,0,0,1.886220697541452,1.654568493195685,CHCHD2,9
GO_Biological_Process_2023,Lipid Transport (GO:0006869),1/108,0.4188872357630098,0.5054265767777855,0,0,1.8684980647597471,1.6258801725332537,APOE,9
GO_Biological_Process_2023,Positive Regulation Of DNA Metabolic Process (GO:0051054),1/108,0.4188872357630098,0.5054265767777855,0,0,1.8684980647597471,1.6258801725332537,RPS3,9
GO_Biological_Process_2023,Response To Tumor Necrosis Factor (GO:0034612),1/108,0.4188872357630098,0.5054265767777855,0,0,1.8684980647597471,1.6258801725332537,RPS3,9
GO_Biological_Process_2023,Negative Regulation Of Developmental Process (GO:0051093),1/109,0.4218085691393649,0.5056176953220772,0,0,1.851103628881407,1.5978794932003777,CST3,9
GO_Biological_Process_2023,Regulation Of Proteasomal Ubiquitin-Dependent Protein Catabolic Process (GO:0032434),1/109,0.4218085691393649,0.5056176953220772,0,0,1.851103628881407,1.5978794932003777,RPL11,9
GO_Biological_Process_2023,Positive Regulation Of Cysteine-Type Endopeptidase Activity Involved In Apoptotic Process (GO:0043280),1/109,0.4218085691393649,0.5056176953220772,0,0,1.851103628881407,1.5978794932003777,RPS3,9
GO_Biological_Process_2023,Adenylate Cyclase-Activating G Protein-Coupled Receptor Signaling Pathway (GO:0007189),1/110,0.4247153626139249,0.5068885523370539,0,0,1.834028356964137,1.570544634474372,GNAS,9
GO_Biological_Process_2023,Sensory Perception Of Chemical Stimulus (GO:0007606),1/110,0.4247153626139249,0.5068885523370539,0,0,1.834028356964137,1.570544634474372,GNAS,9
GO_Biological_Process_2023,Mitotic Sister Chromatid Segregation (GO:0000070),1/111,0.4276076879640406,0.5081312136196067,0,0,1.817263544536272,1.5438546462627225,ZWINT,9
GO_Biological_Process_2023,Cytoskeleton Organization (GO:0007010),1/111,0.4276076879640406,0.5081312136196067,0,0,1.817263544536272,1.5438546462627225,APOE,9
GO_Biological_Process_2023,Protein Deubiquitination (GO:0016579),1/112,0.4304856163806702,0.5093461280021292,0,0,1.8008008008008007,1.517789408820894,UCHL1,9
GO_Biological_Process_2023,Negative Regulation Of Defense Response (GO:0031348),1/112,0.4304856163806702,0.5093461280021292,0,0,1.8008008008008007,1.517789408820894,APOE,9
GO_Biological_Process_2023,Negative Regulation Of Apoptotic Process (GO:0043066),3/482,0.4344568844987508,0.5127901769651204,0,0,1.2539655209521554,1.0453791022147123,RPL10;APOE;MT3,9
GO_Biological_Process_2023,Protein Modification By Small Protein Removal (GO:0070646),1/114,0.4361985658337181,0.5127901769651204,0,0,1.768749441315813,1.4674566165007243,UCHL1,9
GO_Biological_Process_2023,Negative Regulation Of Canonical Wnt Signaling Pathway (GO:0090090),1/114,0.4361985658337181,0.5127901769651204,0,0,1.768749441315813,1.4674566165007243,APOE,9
GO_Biological_Process_2023,Protein Maturation (GO:0051604),1/117,0.4446617754820939,0.5216224673924563,0,0,1.7227446882619295,1.396183515184437,NNAT,9
GO_Biological_Process_2023,Regulation Of Protein Binding (GO:0043393),1/118,0.4474548000683968,0.5226652877394677,0,0,1.7079340412673747,1.3734859734012153,RPL11,9
GO_Biological_Process_2023,Positive Regulation Of Cell Projection Organization (GO:0031346),1/118,0.4474548000683968,0.5226652877394677,0,0,1.7079340412673747,1.3734859734012153,APOE,9
GO_Biological_Process_2023,Regulation Of Protein Kinase Activity (GO:0045859),1/119,0.450233917137087,0.5236830942971626,0,0,1.6933744221879816,1.3512924945163796,PPIA,9
GO_Biological_Process_2023,Cellular Response To Tumor Necrosis Factor (GO:0071356),1/119,0.450233917137087,0.5236830942971626,0,0,1.6933744221879816,1.3512924945163796,RPS3,9
GO_Biological_Process_2023,Cellular Response To Cytokine Stimulus (GO:0071345),2/308,0.4572919096266198,0.5297191615659331,0,0,1.3067893824196346,1.0224755812740838,RPS3;GAPDH,9
GO_Biological_Process_2023,Protein Localization To Nucleus (GO:0034504),1/122,0.4584885070164566,0.5297191615659331,0,0,1.6511394941147006,1.2875916896026691,RPL11,9
GO_Biological_Process_2023,Receptor-Mediated Endocytosis (GO:0006898),1/122,0.4584885070164566,0.5297191615659331,0,0,1.6511394941147006,1.2875916896026691,APOE,9
GO_Biological_Process_2023,Organonitrogen Compound Biosynthetic Process (GO:1901566),1/123,0.4612126761903752,0.5297191615659331,0,0,1.6375227686703095,1.2672723299658175,APOE,9
GO_Biological_Process_2023,Modulation Of Chemical Synaptic Transmission (GO:0050804),1/123,0.4612126761903752,0.5297191615659331,0,0,1.6375227686703095,1.2672723299658175,HCRT,9
GO_Biological_Process_2023,Regulation Of Cell Motility (GO:2000145),1/123,0.4612126761903752,0.5297191615659331,0,0,1.6375227686703095,1.2672723299658175,TMSB10,9
GO_Biological_Process_2023,Negative Regulation Of Growth (GO:0045926),1/124,0.4639232772068564,0.531719998301804,0,0,1.6241274533957462,1.2473885010387038,MT3,9
GO_Biological_Process_2023,Negative Regulation Of Cell Growth (GO:0030308),1/125,0.4666203770761902,0.5336970562808926,0,0,1.6109481915933528,1.2279279396515803,MT3,9
GO_Biological_Process_2023,Regulation Of Anatomical Structure Morphogenesis (GO:0022603),1/127,0.4719743392071369,0.5386983622135513,0,0,1.5852172518839185,1.1902297169988545,SPARC,9
GO_Biological_Process_2023,Positive Regulation Of Cytokine Production (GO:0001819),2/320,0.4771081574446097,0.5413719526235333,0,0,1.2567064561673726,0.929977944288716,RPS3;GAPDH,9
GO_Biological_Process_2023,Protein Targeting (GO:0006605),1/129,0.4772750912018035,0.5413719526235333,0,0,1.560290404040404,1.1540879003160078,RPL11,9
GO_Biological_Process_2023,Regulation Of DNA Repair (GO:0006282),1/129,0.4772750912018035,0.5413719526235333,0,0,1.560290404040404,1.1540879003160078,RPS3,9
GO_Biological_Process_2023,Regulation Of Cell Cycle Process (GO:0010564),1/130,0.4799056771939823,0.5432334366587552,0,0,1.5481168271865946,1.1365742744783855,RPL17,9
GO_Biological_Process_2023,Plasma Membrane Bounded Cell Projection Organization (GO:0120036),1/132,0.4851275940329752,0.5480145043705831,0,0,1.5243272418844938,1.1026119616962,APOE,9
GO_Biological_Process_2023,Cellular Response To Metal Ion (GO:0071248),1/135,0.4928632963661163,0.5556097529876752,0,0,1.4899743705713857,1.0541917813157848,MT3,9
GO_Biological_Process_2023,Protein Localization To Organelle (GO:0033365),1/137,0.4979563925252978,0.56020094159096,0,0,1.467914438502674,1.0234927306951356,RPL11,9
GO_Biological_Process_2023,Negative Regulation Of Wnt Signaling Pathway (GO:0030178),1/140,0.5055012372413341,0.5675259289273874,0,0,1.4360148245040332,0.9796561960455776,APOE,9
GO_Biological_Process_2023,Negative Regulation Of Response To External Stimulus (GO:0032102),1/146,0.5202557726245733,0.5805293072579081,0,0,1.3761755485893417,0.899240881378034,APOE,9
GO_Biological_Process_2023,Neuron Projection Morphogenesis (GO:0048812),1/146,0.5202557726245733,0.5805293072579081,0,0,1.3761755485893417,0.899240881378034,UBB,9
GO_Biological_Process_2023,Positive Regulation Of Cellular Catabolic Process (GO:0031331),1/146,0.5202557726245733,0.5805293072579081,0,0,1.3761755485893417,0.899240881378034,APOE,9
GO_Biological_Process_2023,Negative Regulation Of Protein Phosphorylation (GO:0001933),1/149,0.5274687471502818,0.5873840612282043,0,0,1.348075348075348,0.8623175106205572,PPIA,9
GO_Biological_Process_2023,Neuron Development (GO:0048666),1/150,0.5298491312613169,0.5888404313005324,0,0,1.3389600705036946,0.8504578563729338,APOE,9
GO_Biological_Process_2023,Negative Regulation Of Transcription By RNA Polymerase II (GO:0000122),4/763,0.5332192071699158,0.5913885752248157,0,0,1.050779534475187,0.6607539912701991,RPS14;RPL10;NDN;RPL17,9
GO_Biological_Process_2023,Regulation Of Cellular Component Organization (GO:0051128),1/153,0.5369192861105836,0.5942917098280451,0,0,1.312333864965444,0.8161502743919713,APOE,9
GO_Biological_Process_2023,Cellular Response To Growth Factor Stimulus (GO:0071363),1/155,0.5415741406288901,0.5982378334109872,0,0,1.295159386068477,0.7942892672270463,EEF1A1,9
GO_Biological_Process_2023,Protein Modification By Small Protein Conjugation (GO:0032446),2/364,0.545905957552914,0.6018119893505016,0,0,1.101477054910362,0.6667334866611279,UBB;RPS27A,9
GO_Biological_Process_2023,Regulation Of Macromolecule Metabolic Process (GO:0060255),1/162,0.557504289374834,0.6121397097335678,0,0,1.238408934061108,0.7235838652550021,APOE,9
GO_Biological_Process_2023,Mitochondrion Organization (GO:0007005),1/162,0.557504289374834,0.6121397097335678,0,0,1.238408934061108,0.7235838652550021,CHCHD2,9
GO_Biological_Process_2023,Adenylate Cyclase-Modulating G Protein-Coupled Receptor Signaling Pathway (GO:0007188),1/163,0.559734829149778,0.6133621181701161,0,0,1.2307020825539343,0.7141667289104645,GNAS,9
GO_Biological_Process_2023,Positive Regulation Of Protein Phosphorylation (GO:0001934),2/377,0.5650100141620913,0.6179093581175061,0,0,1.0625850340136054,0.6066423597241232,PPIA;MT3,9
GO_Biological_Process_2023,Regulation Of Cytokine Production (GO:0001817),1/167,0.5685462179076766,0.6205405042372056,0,0,1.2008032128514057,0.6780607576727649,GAPDH,9
GO_Biological_Process_2023,Negative Regulation Of Programmed Cell Death (GO:0043069),2/381,0.5707728050928444,0.6217346626904198,0,0,1.0511550266544614,0.5894499373210654,RPL10;MT3,9
GO_Biological_Process_2023,Brain Development (GO:0007420),1/169,0.5728862133976284,0.6228010517926693,0,0,1.1863876863876863,0.6608988084033616,NNAT,9
GO_Biological_Process_2023,Positive Regulation Of I-kappaB kinase/NF-kappaB Signaling (GO:0043123),1/175,0.5856485564286572,0.6354171096429502,0,0,1.145129455474283,0.6126847989798073,GAPDH,9
GO_Biological_Process_2023,Positive Regulation Of Hydrolase Activity (GO:0051345),1/176,0.5877385951928842,0.6364269995283893,0,0,1.1385281385281385,0.6050969607350297,RPS3,9
GO_Biological_Process_2023,Cellular Response To Oxygen-Containing Compound (GO:1901701),2/406,0.6055495918983245,0.6544226888822444,0,0,0.984845423317842,0.4940169961241648,RPS3;MT3,9
GO_Biological_Process_2023,Negative Regulation Of Macromolecule Metabolic Process (GO:0010605),1/186,0.6080733489730797,0.6558590738432628,0,0,1.0764400764400763,0.5354856269608474,APOE,9
GO_Biological_Process_2023,Endocytosis (GO:0006897),1/189,0.6139778143964273,0.6609290590267423,0,0,1.0591016548463357,0.5166260638484753,APOE,9
GO_Biological_Process_2023,Intracellular Monoatomic Cation Homeostasis (GO:0030003),1/190,0.6159263323660239,0.6617290733247498,0,0,1.0534444978889423,0.5105286083837139,MT3,9
GO_Biological_Process_2023,Regulation Of Signal Transduction (GO:0009966),1/193,0.6217136526856437,0.6666421783680047,0,0,1.0368265993265993,0.4927784439166676,PPIA,9
GO_Biological_Process_2023,Regulation Of Programmed Cell Death (GO:0043067),1/195,0.6255238170451477,0.6694202252588423,0,0,1.0260335311881703,0.4813799173761787,RPS3,9
GO_Biological_Process_2023,Anterograde Trans-Synaptic Signaling (GO:0098916),1/199,0.6330305302852147,0.6761357220361535,0,0,1.0051015202530351,0.4595692288153314,HCRT,9
GO_Biological_Process_2023,Protein Ubiquitination (GO:0016567),2/434,0.6419545041111138,0.6832759611067704,0,0,0.9196900982615268,0.4076414560016024,UBB;RPS27A,9
GO_Biological_Process_2023,Regulation Of MAPK Cascade (GO:0043408),1/204,0.6422047284719372,0.6832759611067704,0,0,0.9800965318206698,0.4340339206746572,PPIA,9
GO_Biological_Process_2023,Regulation Of Angiogenesis (GO:0045765),1/205,0.6440121337651465,0.6838736198009003,0,0,0.975242622301446,0.4291435319722849,SPARC,9
GO_Biological_Process_2023,Regulation Of Canonical Wnt Signaling Pathway (GO:0060828),1/207,0.647599871163211,0.6863558480088858,0,0,0.9656761792684124,0.4195691650534423,APOE,9
GO_Biological_Process_2023,Proteasomal Protein Catabolic Process (GO:0010498),1/220,0.6700631622295644,0.708795136924915,0,0,0.9077533324108666,0.3634492739597634,UCHL1,9
GO_Biological_Process_2023,Regulation Of Cell Growth (GO:0001558),1/227,0.6815654540395655,0.7195758351302336,0,0,0.8793242156074015,0.3371003590491747,MT3,9
GO_Biological_Process_2023,Negative Regulation Of Multicellular Organismal Process (GO:0051241),1/231,0.6879590095762926,0.7249318546206999,0,0,0.8638559508124726,0.323104604801154,RPS19,9
GO_Biological_Process_2023,Regulation Of I-kappaB kinase/NF-kappaB Signaling (GO:0043122),1/232,0.6895374384771322,0.7252031680535356,0,0,0.8600725873453147,0.3197184684889406,GAPDH,9
GO_Biological_Process_2023,Positive Regulation Of Developmental Process (GO:0051094),1/233,0.6911079624436063,0.7254651460450092,0,0,0.8563218390804598,0.3163760043404945,APOE,9
GO_Biological_Process_2023,Regulation Of Inflammatory Response (GO:0050727),1/240,0.7018835601138744,0.7353703711880096,0,0,0.8309454376399983,0.2941445120731517,APOE,9
GO_Biological_Process_2023,Positive Regulation Of Programmed Cell Death (GO:0043068),1/245,0.7093517402446249,0.7417792483700936,0,0,0.8137108792846498,0.2794313819539435,RPS6,9
GO_Biological_Process_2023,Cytokine-Mediated Signaling Pathway (GO:0019221),1/257,0.7265281393419019,0.7582964800355593,0,0,0.775094696969697,0.2476257531837981,MT3,9
GO_Biological_Process_2023,Negative Regulation Of DNA-templated Transcription (GO:0045892),4/1025,0.7602214715268273,0.7906138188658683,0,0,0.7704456415279138,0.2112141888620354,RPS14;RPL10;NDN;RPL17,9
GO_Biological_Process_2023,Central Nervous System Development (GO:0007417),1/283,0.7603717602207258,0.7906138188658683,0,0,0.7027007665305538,0.1925033340493977,NNAT,9
GO_Biological_Process_2023,DNA Metabolic Process (GO:0006259),1/288,0.7663876903684957,0.7953626503068131,0,0,0.6902826171118854,0.1836615038360822,RPS3,9
GO_Biological_Process_2023,DNA Repair (GO:0006281),1/291,0.769925222013722,0.797526314878365,0,0,0.6830372692441657,0.1785882106564904,RPS3,9
GO_Biological_Process_2023,Positive Regulation Of Nucleic Acid-Templated Transcription (GO:1903508),2/557,0.77143447732575,0.7975847985910296,0,0,0.7113439970582828,0.1845962851964433,APOE;MT3,9
GO_Biological_Process_2023,Regulation Of Intracellular Signal Transduction (GO:1902531),1/297,0.7768419503727892,0.8013283847957855,0,0,0.668987168987169,0.1689315423580777,RPL11,9
GO_Biological_Process_2023,Regulation Of Cell Cycle (GO:0051726),1/298,0.7779745520877116,0.8013283847957855,0,0,0.6667006768016869,0.1673828484593392,RPS15A,9
GO_Biological_Process_2023,Protein Transport (GO:0015031),1/313,0.7942962380792371,0.8166079301601146,0,0,0.6341621341621342,0.1460467731127653,APOE,9
GO_Biological_Process_2023,Supramolecular Fiber Organization (GO:0097435),1/316,0.7974150897750656,0.8182820267037589,0,0,0.6280262946929613,0.1421725426601114,CST3,9
GO_Biological_Process_2023,Proteasome-Mediated Ubiquitin-Dependent Protein Catabolic Process (GO:0043161),1/319,0.800487119011081,0.8199019185393349,0,0,0.6220062257798107,0.1384180545980848,UCHL1,9
GO_Biological_Process_2023,Intracellular Protein Transport (GO:0006886),1/325,0.8064934843181244,0.8245156850850098,0,0,0.6103005362264622,0.1312509040089776,RPL11,9
GO_Biological_Process_2023,Protein-Containing Complex Assembly (GO:0065003),1/328,0.809429181545872,0.8259788488265496,0,0,0.6046087789207055,0.1278300119944724,RPL38,9
GO_Biological_Process_2023,Ubiquitin-Dependent Protein Catabolic Process (GO:0006511),1/367,0.8438095427024295,0.8594646362590609,0,0,0.5391069161560965,0.0915557028215654,UCHL1,9
GO_Biological_Process_2023,Negative Regulation Of Cell Population Proliferation (GO:0008285),1/379,0.8530956281489461,0.8673138886180952,0,0,0.5216717438939661,0.0828851002051982,APOE,9
GO_Biological_Process_2023,DNA Damage Response (GO:0006974),1/384,0.8568015435265478,0.8694714369613211,0,0,0.5147295408392014,0.0795509143679762,RPS3,9
GO_Biological_Process_2023,Nervous System Development (GO:0007399),1/433,0.8885593282858228,0.8989534808577846,0,0,0.4552001496445941,0.0537836547902817,LY6H,9
GO_Biological_Process_2023,Regulation Of Cell Migration (GO:0030334),1/434,0.8891288526516886,0.8989534808577846,0,0,0.4541255511232416,0.0533657071397892,TMSB10,9
GO_Biological_Process_2023,Regulation Of Nucleic Acid-Templated Transcription (GO:1903506),1/452,0.8989012362084778,0.9071631961001,0,0,0.4355976617617416,0.0464269179704126,RPL6,9
GO_Biological_Process_2023,Negative Regulation Of Cellular Process (GO:0048523),1/537,0.9346848732652404,0.9415449457295726,0,0,0.3649178350670888,0.024648681862273,MT3,9
GO_Biological_Process_2023,Positive Regulation Of DNA-templated Transcription (GO:0045893),3/1243,0.9523911188504394,0.9576240370858812,0,0,0.4654140339208513,0.0227026589498195,CHCHD2;APOE;MT3,9
GO_Biological_Process_2023,Regulation Of Transcription By RNA Polymerase II (GO:0006357),5/2028,0.9787833353546628,0.9823620678422482,0,0,0.4650987329916486,0.0099740298394101,RPS14;CHCHD2;RPL10;NDN;RPL17,9
GO_Biological_Process_2023,Positive Regulation Of Transcription By RNA Polymerase II (GO:0045944),1/938,0.9918966487716568,0.993706679152627,0,0,0.2044241777432812,0.0016632690770951,CHCHD2,9
GO_Biological_Process_2023,Regulation Of DNA-templated Transcription (GO:0006355),3/1922,0.9972771263007923,0.9972771263007923,0,0,0.2897933309337445,0.0007901468629085932,APOE;MT3;RPL6,9
MSigDB_Hallmark_2020,Myc Targets V1,9/200,7.246130877532363e-07,1.376764866731149e-05,0,0,10.205454231632242,144.28091546324455,RPL34;RPS5;RPS6;RPL14;RPS3;RPS2;RPS10;PPIA;RPL6,9
MSigDB_Hallmark_2020,Allograft Rejection,4/200,0.0180733221304631,0.1716965602393995,0,0,4.188775510204081,16.81088959163861,RPS9;RPS19;RPL9;RPL39,9
MSigDB_Hallmark_2020,Hedgehog Signaling,1/36,0.165238740567014,0.6275398827283275,0,0,5.733044733044733,10.321566994169176,SCG2,9
MSigDB_Hallmark_2020,Hypoxia,2/200,0.2642273190435063,0.6275398827283275,0,0,2.0307153164296023,2.702771390555414,GAA;GAPDH,9
MSigDB_Hallmark_2020,p53 Pathway,2/200,0.2642273190435063,0.6275398827283275,0,0,2.0307153164296023,2.702771390555414,RPL36;RPS12,9
MSigDB_Hallmark_2020,Myogenesis,2/200,0.2642273190435063,0.6275398827283275,0,0,2.0307153164296023,2.702771390555414,SPARC;GAA,9
MSigDB_Hallmark_2020,mTORC1 Signaling,2/200,0.2642273190435063,0.6275398827283275,0,0,2.0307153164296023,2.702771390555414,PPIA;GAPDH,9
MSigDB_Hallmark_2020,Epithelial Mesenchymal Transition,2/200,0.2642273190435063,0.6275398827283275,0,0,2.0307153164296023,2.702771390555414,SPARC;SCG2,9
MSigDB_Hallmark_2020,Protein Secretion,1/96,0.3826705658807354,0.6348838112697764,0,0,2.105794790005316,2.022786046627892,GNAS,9
MSigDB_Hallmark_2020,Androgen Response,1/100,0.394984420817951,0.6348838112697764,0,0,2.020304050607081,1.8766785261005492,DBI,9
MSigDB_Hallmark_2020,Unfolded Protein Response,1/113,0.4333492188372186,0.6348838112697764,0,0,1.7846320346320346,1.492329591518098,RPS14,9
MSigDB_Hallmark_2020,Spermatogenesis,1/135,0.4928632963661163,0.6348838112697764,0,0,1.4899743705713857,1.0541917813157848,PCSK1N,9
MSigDB_Hallmark_2020,Coagulation,1/138,0.5004839181972011,0.6348838112697764,0,0,1.45712600457126,1.0085932042209516,SPARC,9
MSigDB_Hallmark_2020,DNA Repair,1/150,0.5298491312613169,0.6348838112697764,0,0,1.3389600705036946,0.8504578563729338,ZWINT,9
MSigDB_Hallmark_2020,Xenobiotic Metabolism,1/200,0.6348838112697764,0.6348838112697764,0,0,1.0,0.454313271209604,APOE,9
MSigDB_Hallmark_2020,Glycolysis,1/200,0.6348838112697764,0.6348838112697764,0,0,1.0,0.454313271209604,PPIA,9
MSigDB_Hallmark_2020,Adipogenesis,1/200,0.6348838112697764,0.6348838112697764,0,0,1.0,0.454313271209604,APOE,9
MSigDB_Hallmark_2020,KRAS Signaling Up,1/200,0.6348838112697764,0.6348838112697764,0,0,1.0,0.454313271209604,PCSK1N,9
MSigDB_Hallmark_2020,Complement,1/200,0.6348838112697764,0.6348838112697764,0,0,1.0,0.454313271209604,MT3,9
