Gene_set,Term,Overlap,P-value,Adjusted P-value,Old P-value,Old Adjusted P-value,Odds Ratio,Combined Score,Genes,cluster
GO_Biological_Process_2023,Negative Regulation Of Proteasomal Ubiquitin-Dependent Protein Catabolic Process (GO:0032435),1/32,0.1483040219339779,0.2938966900998387,0,0,6.474095796676441,12.355752978101908,RPL11,9
GO_Biological_Process_2023,Regulation Of Ubiquitin-Protein Transferase Activity (GO:0051438),1/32,0.1483040219339779,0.2938966900998387,0,0,6.474095796676441,12.355752978101908,RPS2,9
GO_Biological_Process_2023,Negative Regulation Of Cellular Biosynthetic Process (GO:0031327),2/137,0.1499507080843318,0.2938966900998387,0,0,2.9879062736205597,5.669398730173793,RPS3;GAPDH,9
GO_Biological_Process_2023,Negative Regulation Of Epithelial Cell Migration (GO:0010633),1/33,0.152569319997184,0.2938966900998387,0,0,6.271464646464646,11.79120788980768,APOE,9
GO_Biological_Process_2023,Positive Regulation Of Protein Dephosphorylation (GO:0035307),1/33,0.152569319997184,0.2938966900998387,0,0,6.271464646464646,11.79120788980768,PPIA,9
GO_Biological_Process_2023,Positive Regulation Of Small Molecule Metabolic Process (GO:0062013),1/33,0.152569319997184,0.2938966900998387,0,0,6.271464646464646,11.79120788980768,APOE,9
GO_Biological_Process_2023,Cardiac Muscle Contraction (GO:0060048),1/33,0.152569319997184,0.2938966900998387,0,0,6.271464646464646,11.79120788980768,GAA,9
GO_Biological_Process_2023,Regulation Of Activated T Cell Proliferation (GO:0046006),1/33,0.152569319997184,0.2938966900998387,0,0,6.271464646464646,11.79120788980768,RPS3,9
GO_Biological_Process_2023,Regulation Of Amyloid-Beta Formation (GO:1902003),1/33,0.152569319997184,0.2938966900998387,0,0,6.271464646464646,11.79120788980768,APOE,9
GO_Biological_Process_2023,Negative Regulation Of Blood Vessel Endothelial Cell Migration (GO:0043537),1/33,0.152569319997184,0.2938966900998387,0,0,6.271464646464646,11.79120788980768,APOE,9
GO_Biological_Process_2023,Superoxide Metabolic Process (GO:0006801),1/34,0.1568134700259566,0.2958439692242274,0,0,6.081114172023263,11.266469699963473,MT3,9
GO_Biological_Process_2023,Negative Regulation Of Mitotic Cell Cycle (GO:0045930),1/34,0.1568134700259566,0.2958439692242274,0,0,6.081114172023263,11.266469699963473,ZWINT,9
GO_Biological_Process_2023,Regulation Of Neuronal Synaptic Plasticity (GO:0048168),1/34,0.1568134700259566,0.2958439692242274,0,0,6.081114172023263,11.266469699963473,APOE,9
GO_Biological_Process_2023,Cellular Response To Hydrogen Peroxide (GO:0070301),1/34,0.1568134700259566,0.2958439692242274,0,0,6.081114172023263,11.266469699963473,RPS3,9
GO_Biological_Process_2023,Regulation Of T Cell Receptor Signaling Pathway (GO:0050856),1/34,0.1568134700259566,0.2958439692242274,0,0,6.081114172023263,11.266469699963473,RPS3,9
GO_Biological_Process_2023,Sister Chromatid Segregation (GO:0000819),1/34,0.1568134700259566,0.2958439692242274,0,0,6.081114172023263,11.266469699963473,ZWINT,9
GO_Biological_Process_2023,Positive Regulation Of Transferase Activity (GO:0051347),2/143,0.1604167144707384,0.3016053980973814,0,0,2.859892893327544,5.233547895270227,APOE;RPS2,9
GO_Biological_Process_2023,"DNA Damage Response, Signal Transduction By P53 Class Mediator (GO:0030330)",1/36,0.165238740567014,0.3083702750694352,0,0,5.733044733044733,10.321566994169176,RPL26,9
GO_Biological_Process_2023,Lytic Vacuole Organization (GO:0080171),1/36,0.165238740567014,0.3083702750694352,0,0,5.733044733044733,10.321566994169176,GAA,9
GO_Biological_Process_2023,Regulation Of Cold-Induced Thermogenesis (GO:0120161),2/146,0.1656998745819369,0.3083702750694352,0,0,2.799886621315193,5.033012105126492,GNAS;HCRT,9
GO_Biological_Process_2023,Negative Regulation Of Endothelial Cell Migration (GO:0010596),1/37,0.1694200671801256,0.309008693959764,0,0,5.57351290684624,9.895070145641316,APOE,9
GO_Biological_Process_2023,Positive Regulation Of Immune Effector Process (GO:0002699),1/37,0.1694200671801256,0.309008693959764,0,0,5.57351290684624,9.895070145641316,RPS19,9
GO_Biological_Process_2023,Negative Regulation Of Smooth Muscle Cell Proliferation (GO:0048662),1/37,0.1694200671801256,0.309008693959764,0,0,5.57351290684624,9.895070145641316,APOE,9
GO_Biological_Process_2023,Negative Regulation Of Stress-Activated MAPK Cascade (GO:0032873),1/37,0.1694200671801256,0.309008693959764,0,0,5.57351290684624,9.895070145641316,PPIA,9
GO_Biological_Process_2023,Melanosome Organization (GO:0032438),1/37,0.1694200671801256,0.309008693959764,0,0,5.57351290684624,9.895070145641316,APOE,9
GO_Biological_Process_2023,Regulation Of Cellular Component Biogenesis (GO:0044087),1/37,0.1694200671801256,0.309008693959764,0,0,5.57351290684624,9.895070145641316,APOE,9
GO_Biological_Process_2023,Skeletal System Development (GO:0001501),2/149,0.1710136332671059,0.3108823995484807,0,0,2.7423295848951827,4.842986951998436,GNAS;RPL13,9
GO_Biological_Process_2023,Fatty Acid Transport (GO:0015908),1/38,0.1735806579316256,0.3134729644883634,0,0,5.422604422604422,9.495592558231127,APOE,9
GO_Biological_Process_2023,Regulation Of Neurotransmitter Secretion (GO:0046928),1/38,0.1735806579316256,0.3134729644883634,0,0,5.422604422604422,9.495592558231127,HCRT,9
GO_Biological_Process_2023,Positive Regulation Of NF-kappaB Transcription Factor Activity (GO:0051092),2/152,0.1763559296827952,0.3137254578716727,0,0,2.687074829931973,4.662749281288076,RPS3;PPIA,9
GO_Biological_Process_2023,Positive Regulation Of Cellular Process (GO:0048522),5/594,0.1766617333227277,0.3137254578716727,0,0,1.725583057814315,2.991330129991557,RPS4X;RPS9;RPS15A;RPS6;RPL17,9
GO_Biological_Process_2023,Positive Regulation Of Lipid Biosynthetic Process (GO:0046889),1/39,0.1777206145684703,0.3137254578716727,0,0,5.279638490164806,9.12080010262218,APOE,9
GO_Biological_Process_2023,Negative Regulation Of Proteasomal Protein Catabolic Process (GO:1901799),1/39,0.1777206145684703,0.3137254578716727,0,0,5.279638490164806,9.12080010262218,RPL11,9
GO_Biological_Process_2023,Negative Regulation Of Protein Secretion (GO:0050709),1/39,0.1777206145684703,0.3137254578716727,0,0,5.279638490164806,9.12080010262218,APOE,9
GO_Biological_Process_2023,Regulation Of Mitochondrial Membrane Potential (GO:0051881),1/39,0.1777206145684703,0.3137254578716727,0,0,5.279638490164806,9.12080010262218,UBB,9
GO_Biological_Process_2023,Organelle Transport Along Microtubule (GO:0072384),1/39,0.1777206145684703,0.3137254578716727,0,0,5.279638490164806,9.12080010262218,UBB,9
GO_Biological_Process_2023,Positive Regulation Of Insulin Secretion (GO:0032024),1/40,0.1818400384456406,0.3149217069610622,0,0,5.144004144004144,8.768612919919887,NNAT,9
GO_Biological_Process_2023,Negative Regulation Of Secretion By Cell (GO:1903531),1/40,0.1818400384456406,0.3149217069610622,0,0,5.144004144004144,8.768612919919887,APOE,9
GO_Biological_Process_2023,Regulation Of Microtubule Polymerization (GO:0031113),1/40,0.1818400384456406,0.3149217069610622,0,0,5.144004144004144,8.768612919919887,RPS3,9
GO_Biological_Process_2023,Regulation Of Protein Dephosphorylation (GO:0035304),1/40,0.1818400384456406,0.3149217069610622,0,0,5.144004144004144,8.768612919919887,PPIA,9
GO_Biological_Process_2023,Regulation Of Small Molecule Metabolic Process (GO:0062012),1/40,0.1818400384456406,0.3149217069610622,0,0,5.144004144004144,8.768612919919887,APOE,9
GO_Biological_Process_2023,Cyclic-Nucleotide-Mediated Signaling (GO:0019935),1/40,0.1818400384456406,0.3149217069610622,0,0,5.144004144004144,8.768612919919887,APOE,9
GO_Biological_Process_2023,Heart Contraction (GO:0060047),1/41,0.1859390303366049,0.3160387853089662,0,0,5.015151515151516,8.43717221072756,GAA,9
GO_Biological_Process_2023,Negative Regulation Of Proteolysis (GO:0045861),1/41,0.1859390303366049,0.3160387853089662,0,0,5.015151515151516,8.43717221072756,CST3,9
GO_Biological_Process_2023,Acylglycerol Metabolic Process (GO:0006639),1/41,0.1859390303366049,0.3160387853089662,0,0,5.015151515151516,8.43717221072756,APOE,9
GO_Biological_Process_2023,Positive Regulation Of Viral Process (GO:0048524),1/41,0.1859390303366049,0.3160387853089662,0,0,5.015151515151516,8.43717221072756,PPIA,9
GO_Biological_Process_2023,Carbohydrate Catabolic Process (GO:0016052),1/41,0.1859390303366049,0.3160387853089662,0,0,5.015151515151516,8.43717221072756,GAPDH,9
GO_Biological_Process_2023,Regulation Of Amide Metabolic Process (GO:0034248),1/41,0.1859390303366049,0.3160387853089662,0,0,5.015151515151516,8.43717221072756,RPL10,9
GO_Biological_Process_2023,Translational Elongation (GO:0006414),1/42,0.1900176905858975,0.3209837296358699,0,0,4.892584380389258,8.124812043283224,EEF1A1,9
GO_Biological_Process_2023,Monocyte Chemotaxis (GO:0002548),1/42,0.1900176905858975,0.3209837296358699,0,0,4.892584380389258,8.124812043283224,RPS19,9
GO_Biological_Process_2023,Regulation Of Primary Metabolic Process (GO:0080090),1/43,0.1940761190078197,0.3238534630252068,0,0,4.775853775853776,7.830035336967146,APOE,9
GO_Biological_Process_2023,Lysosome Organization (GO:0007040),1/43,0.1940761190078197,0.3238534630252068,0,0,4.775853775853776,7.830035336967146,GAA,9
GO_Biological_Process_2023,Regulation Of JUN Kinase Activity (GO:0043506),1/43,0.1940761190078197,0.3238534630252068,0,0,4.775853775853776,7.830035336967146,RPS3,9
GO_Biological_Process_2023,Energy Derivation By Oxidation Of Organic Compounds (GO:0015980),1/43,0.1940761190078197,0.3238534630252068,0,0,4.775853775853776,7.830035336967146,MT3,9
GO_Biological_Process_2023,Nucleus Organization (GO:0006997),1/44,0.1981144149654997,0.3285946036738954,0,0,4.664552501761804,7.551493311263548,RPS19,9
GO_Biological_Process_2023,Positive Regulation Of Biosynthetic Process (GO:0009891),1/44,0.1981144149654997,0.3285946036738954,0,0,4.664552501761804,7.551493311263548,APOE,9
GO_Biological_Process_2023,Positive Regulation Of Innate Immune Response (GO:0045089),1/45,0.2021326772791743,0.3310307557518722,0,0,4.558310376492194,7.287967841732019,RPS19,9
GO_Biological_Process_2023,Triglyceride Metabolic Process (GO:0006641),1/45,0.2021326772791743,0.3310307557518722,0,0,4.558310376492194,7.287967841732019,APOE,9
GO_Biological_Process_2023,Hexose Metabolic Process (GO:0019318),1/45,0.2021326772791743,0.3310307557518722,0,0,4.558310376492194,7.287967841732019,GAA,9
GO_Biological_Process_2023,Mitotic Nuclear Division (GO:0140014),1/45,0.2021326772791743,0.3310307557518722,0,0,4.558310376492194,7.287967841732019,ZWINT,9
GO_Biological_Process_2023,Positive Regulation Of MAPK Cascade (GO:0043410),3/310,0.2025980581650802,0.3310307557518722,0,0,1.9738406259444572,3.151298284847128,APOE;PPIA;MT3,9
GO_Biological_Process_2023,Positive Regulation Of Peptide Hormone Secretion (GO:0090277),1/46,0.2061310043831236,0.3338227770098374,0,0,4.45679012345679,7.038356248208516,NNAT,9
GO_Biological_Process_2023,Response To Hydrogen Peroxide (GO:0042542),1/46,0.2061310043831236,0.3338227770098374,0,0,4.45679012345679,7.038356248208516,RPS3,9
GO_Biological_Process_2023,Negative Regulation Of Cellular Metabolic Process (GO:0031324),1/46,0.2061310043831236,0.3338227770098374,0,0,4.45679012345679,7.038356248208516,MT3,9
GO_Biological_Process_2023,Negative Regulation Of Hydrolase Activity (GO:0051346),1/47,0.2101094941683413,0.3372810301123373,0,0,4.359683794466403,6.801658146757973,CST3,9
GO_Biological_Process_2023,Regulation Of Interleukin-2 Production (GO:0032663),1/47,0.2101094941683413,0.3372810301123373,0,0,4.359683794466403,6.801658146757973,RPS3,9
GO_Biological_Process_2023,Secondary Alcohol Metabolic Process (GO:1902652),1/47,0.2101094941683413,0.3372810301123373,0,0,4.359683794466403,6.801658146757973,APOE,9
GO_Biological_Process_2023,Regulation Of Neuron Projection Development (GO:0010975),2/174,0.2162216576285956,0.345074680343311,0,0,2.340768865685809,3.5847732993930266,APOE;MT3,9
GO_Biological_Process_2023,Positive Regulation Of Cellular Biosynthetic Process (GO:0031328),2/174,0.2162216576285956,0.345074680343311,0,0,2.340768865685809,3.5847732993930266,RPS4X;RPL26,9
GO_Biological_Process_2023,Negative Regulation Of DNA Metabolic Process (GO:0051053),1/49,0.21800735103248,0.3469160455560334,0,0,4.177609427609427,6.363445371866637,RPS3,9
GO_Biological_Process_2023,Positive Regulation Of Transport (GO:0051050),1/50,0.2219269115603851,0.349105657440262,0,0,4.092145949288806,6.1603458876211565,APOE,9
GO_Biological_Process_2023,Plasma Membrane Bounded Cell Projection Morphogenesis (GO:0120039),1/50,0.2219269115603851,0.349105657440262,0,0,4.092145949288806,6.1603458876211565,UBB,9
GO_Biological_Process_2023,Pyruvate Metabolic Process (GO:0006090),1/50,0.2219269115603851,0.349105657440262,0,0,4.092145949288806,6.1603458876211565,GAPDH,9
GO_Biological_Process_2023,Positive Regulation Of Cell Death (GO:0010942),1/50,0.2219269115603851,0.349105657440262,0,0,4.092145949288806,6.1603458876211565,MT3,9
GO_Biological_Process_2023,Positive Regulation Of ERK1 And ERK2 Cascade (GO:0070374),2/179,0.2254063988806415,0.3512153962872508,0,0,2.274068949613744,3.388022281285932,APOE;MT3,9
GO_Biological_Process_2023,Regulation Of Stress-Activated MAPK Cascade (GO:0032872),1/51,0.2258270216564654,0.3512153962872508,0,0,4.01010101010101,5.966974015935645,PPIA,9
GO_Biological_Process_2023,Cholesterol Transport (GO:0030301),1/51,0.2258270216564654,0.3512153962872508,0,0,4.01010101010101,5.966974015935645,APOE,9
GO_Biological_Process_2023,Sensory Perception (GO:0007600),1/51,0.2258270216564654,0.3512153962872508,0,0,4.01010101010101,5.966974015935645,GNAS,9
GO_Biological_Process_2023,Negative Regulation Of Innate Immune Response (GO:0045824),1/52,0.2297077768169888,0.3522613672416952,0,0,3.9312735195088138,5.782696221966044,RPS19,9
GO_Biological_Process_2023,Negative Regulation Of Response To Stimulus (GO:0048585),1/52,0.2297077768169888,0.3522613672416952,0,0,3.9312735195088138,5.782696221966044,RPS3,9
GO_Biological_Process_2023,Regulation Of Proteolysis (GO:0030162),1/52,0.2297077768169888,0.3522613672416952,0,0,3.9312735195088138,5.782696221966044,CST3,9
GO_Biological_Process_2023,Cellular Response To Ionizing Radiation (GO:0071479),1/52,0.2297077768169888,0.3522613672416952,0,0,3.9312735195088138,5.782696221966044,RPL26,9
GO_Biological_Process_2023,Regulation Of Cell Development (GO:0060284),1/52,0.2297077768169888,0.3522613672416952,0,0,3.9312735195088138,5.782696221966044,RPS19,9
GO_Biological_Process_2023,Regulation Of Macromolecule Biosynthetic Process (GO:0010556),1/53,0.233569272224541,0.3561931401424251,0,0,3.8554778554778553,5.606931137649977,RPL10,9
GO_Biological_Process_2023,Positive Regulation Of NIK/NF-kappaB Signaling (GO:1901224),1/53,0.233569272224541,0.3561931401424251,0,0,3.8554778554778553,5.606931137649977,RPS3,9
GO_Biological_Process_2023,Negative Regulation Of Protein Catabolic Process (GO:0042177),1/54,0.2374116024468537,0.358074092701436,0,0,3.7825424051839143,5.43914439332398,CST3,9
GO_Biological_Process_2023,Negative Regulation Of Protein Ubiquitination (GO:0031397),1/54,0.2374116024468537,0.358074092701436,0,0,3.7825424051839143,5.43914439332398,RPS3,9
GO_Biological_Process_2023,Regulation Of Smooth Muscle Cell Proliferation (GO:0048660),1/54,0.2374116024468537,0.358074092701436,0,0,3.7825424051839143,5.43914439332398,APOE,9
GO_Biological_Process_2023,Regulation Of Blood Vessel Endothelial Cell Migration (GO:0043535),1/54,0.2374116024468537,0.358074092701436,0,0,3.7825424051839143,5.43914439332398,APOE,9
GO_Biological_Process_2023,Regulation Of Reactive Oxygen Species Metabolic Process (GO:2000377),1/56,0.2450391435680432,0.3675587153520649,0,0,3.644628099173554,5.125576482532065,MT3,9
GO_Biological_Process_2023,Cellular Response To Peptide (GO:1901653),1/56,0.2450391435680432,0.3675587153520649,0,0,3.644628099173554,5.125576482532065,RPL17,9
GO_Biological_Process_2023,Striated Muscle Contraction (GO:0006941),1/57,0.2488245414130006,0.3700682671653525,0,0,3.5793650793650795,4.978922896997587,GAA,9
GO_Biological_Process_2023,Post-Transcriptional Regulation Of Gene Expression (GO:0010608),1/57,0.2488245414130006,0.3700682671653525,0,0,3.5793650793650795,4.978922896997587,RPL10,9
GO_Biological_Process_2023,Neuron Projection Development (GO:0031175),2/192,0.2494084860677239,0.3700682671653525,0,0,2.117078410311493,2.939908923064224,UBB;APOE,9
GO_Biological_Process_2023,Modification-Dependent Protein Catabolic Process (GO:0019941),2/192,0.2494084860677239,0.3700682671653525,0,0,2.117078410311493,2.939908923064224,UBB;RPS27A,9
GO_Biological_Process_2023,Regulation Of Neuron Death (GO:1901214),1/58,0.2525911479606718,0.3727756457806688,0,0,3.5163919900762006,4.8384959983786695,UBB,9
GO_Biological_Process_2023,Memory (GO:0007613),1/58,0.2525911479606718,0.3727756457806688,0,0,3.5163919900762006,4.8384959983786695,APOE,9
GO_Biological_Process_2023,Glucose Metabolic Process (GO:0006006),1/59,0.256339055642632,0.3742822913505451,0,0,3.4555903866248694,4.703937185372145,GAA,9
GO_Biological_Process_2023,Positive Regulation Of Proteolysis (GO:0045862),1/59,0.256339055642632,0.3742822913505451,0,0,3.4555903866248694,4.703937185372145,APOE,9
GO_Biological_Process_2023,Phospholipid Transport (GO:0015914),1/59,0.256339055642632,0.3742822913505451,0,0,3.4555903866248694,4.703937185372145,APOE,9
GO_Biological_Process_2023,Regulation Of Type I Interferon Production (GO:0032479),1/59,0.256339055642632,0.3742822913505451,0,0,3.4555903866248694,4.703937185372145,GAPDH,9
GO_Biological_Process_2023,Sterol Metabolic Process (GO:0016125),1/60,0.2600683562676618,0.3777183269601755,0,0,3.396849854476973,4.574913980988086,APOE,9
GO_Biological_Process_2023,protein-DNA Complex Organization (GO:0071824),1/60,0.2600683562676618,0.3777183269601755,0,0,3.396849854476973,4.574913980988086,RPL17,9
GO_Biological_Process_2023,Negative Regulation Of Intrinsic Apoptotic Signaling Pathway (GO:2001243),1/61,0.2637791413086752,0.3810914436275334,0,0,3.34006734006734,4.451117734093463,PPIA,9
GO_Biological_Process_2023,Negative Regulation Of Viral Process (GO:0048525),1/61,0.2637791413086752,0.3810914436275334,0,0,3.34006734006734,4.451117734093463,PPIA,9
GO_Biological_Process_2023,Negative Regulation Of Kinase Activity (GO:0033673),1/62,0.2674715018007107,0.3833990978814365,0,0,3.285146547441629,4.332261561529935,PPIA,9
GO_Biological_Process_2023,Protein-Containing Complex Disassembly (GO:0032984),1/62,0.2674715018007107,0.3833990978814365,0,0,3.285146547441629,4.332261561529935,RPL17,9
GO_Biological_Process_2023,Positive Regulation Of Apoptotic Signaling Pathway (GO:2001235),1/62,0.2674715018007107,0.3833990978814365,0,0,3.285146547441629,4.332261561529935,RPS3,9
GO_Biological_Process_2023,Positive Regulation Of Type I Interferon Production (GO:0032481),1/64,0.2748013108427819,0.3908443514318323,0,0,3.180535513868848,4.108319823136149,GAPDH,9
GO_Biological_Process_2023,Regulation Of Secretion By Cell (GO:1903530),1/64,0.2748013108427819,0.3908443514318323,0,0,3.180535513868848,4.108319823136149,HCRT,9
GO_Biological_Process_2023,Negative Regulation Of Cell Death (GO:0060548),1/64,0.2748013108427819,0.3908443514318323,0,0,3.180535513868848,4.108319823136149,MT3,9
GO_Biological_Process_2023,Cellular Response To Light Stimulus (GO:0071482),1/65,0.2784389392137884,0.3929639527721589,0,0,3.1306818181818183,4.00275356439037,RPL26,9
GO_Biological_Process_2023,Positive Regulation Of T Cell Proliferation (GO:0042102),1/65,0.2784389392137884,0.3929639527721589,0,0,3.1306818181818183,4.00275356439037,RPS3,9
GO_Biological_Process_2023,Positive Regulation Of Cell Cycle (GO:0045787),1/65,0.2784389392137884,0.3929639527721589,0,0,3.1306818181818183,4.00275356439037,RPS15A,9
GO_Biological_Process_2023,Regulation Of Endocytosis (GO:0030100),1/66,0.2820585025763683,0.396036107198021,0,0,3.0823620823620823,3.9011631304837175,APOE,9
GO_Biological_Process_2023,Cellular Response To Type II Interferon (GO:0071346),1/66,0.2820585025763683,0.396036107198021,0,0,3.0823620823620823,3.9011631304837175,GAPDH,9
GO_Biological_Process_2023,Regulation Of Viral Genome Replication (GO:0045069),1/67,0.2856600898087258,0.3990518811831819,0,0,3.0355065809611266,3.8033460819667058,PPIA,9
GO_Biological_Process_2023,Cholesterol Metabolic Process (GO:0008203),1/67,0.2856600898087258,0.3990518811831819,0,0,3.0355065809611266,3.8033460819667058,APOE,9
GO_Biological_Process_2023,Regulation Of Endopeptidase Activity (GO:0052548),1/69,0.2928096888806698,0.408001317755045,0,0,2.9459298871063577,3.6182865561027495,GAPDH,9
GO_Biological_Process_2023,Positive Regulation Of Protein Polymerization (GO:0032273),1/70,0.2963578762035246,0.4087951608938066,0,0,2.9030888596105986,3.530700422312052,RPS3,9
GO_Biological_Process_2023,Positive Regulation Of Protein Transport (GO:0051222),1/70,0.2963578762035246,0.4087951608938066,0,0,2.9030888596105986,3.530700422312052,PPIA,9
GO_Biological_Process_2023,Neutrophil Chemotaxis (GO:0030593),1/70,0.2963578762035246,0.4087951608938066,0,0,2.9030888596105986,3.530700422312052,PPIA,9
GO_Biological_Process_2023,Regulation Of Cellular Biosynthetic Process (GO:0031326),1/70,0.2963578762035246,0.4087951608938066,0,0,2.9030888596105986,3.530700422312052,RPL10,9
GO_Biological_Process_2023,Negative Regulation Of Supramolecular Fiber Organization (GO:1902904),1/71,0.2998884383134025,0.4126284527169373,0,0,2.8614718614718613,3.446198601550195,APOE,9
GO_Biological_Process_2023,Cellular Response To Hypoxia (GO:0071456),1/72,0.3034014618596549,0.4139716736570618,0,0,2.821027173139849,3.3646345783285243,MT3,9
GO_Biological_Process_2023,Cholesterol Homeostasis (GO:0042632),1/72,0.3034014618596549,0.4139716736570618,0,0,2.821027173139849,3.3646345783285243,APOE,9
GO_Biological_Process_2023,Second-Messenger-Mediated Signaling (GO:0019932),1/72,0.3034014618596549,0.4139716736570618,0,0,2.821027173139849,3.3646345783285243,APOE,9
GO_Biological_Process_2023,Sterol Homeostasis (GO:0055092),1/73,0.3068970331118836,0.4139716736570618,0,0,2.781705948372615,3.2858706369655613,APOE,9
GO_Biological_Process_2023,Granulocyte Chemotaxis (GO:0071621),1/73,0.3068970331118836,0.4139716736570618,0,0,2.781705948372615,3.2858706369655613,PPIA,9
GO_Biological_Process_2023,Positive Regulation Of Secretion By Cell (GO:1903532),1/73,0.3068970331118836,0.4139716736570618,0,0,2.781705948372615,3.2858706369655613,PPIA,9
GO_Biological_Process_2023,Cellular Response To Decreased Oxygen Levels (GO:0036294),1/73,0.3068970331118836,0.4139716736570618,0,0,2.781705948372615,3.2858706369655613,MT3,9
GO_Biological_Process_2023,Regulation Of Rho Protein Signal Transduction (GO:0035023),1/73,0.3068970331118836,0.4139716736570618,0,0,2.781705948372615,3.2858706369655613,APOE,9
GO_Biological_Process_2023,Positive Regulation Of Protein Modification Process (GO:0031401),2/225,0.310472504438317,0.4177681493545001,0,0,1.800768737988469,2.106287043338685,PPIA;MT3,9
GO_Biological_Process_2023,Negative Regulation Of Phosphorylation (GO:0042326),1/75,0.3138361616484454,0.4212617426528033,0,0,2.7062517062517064,3.1362323637249645,PPIA,9
GO_Biological_Process_2023,Apoptotic Process (GO:0006915),2/228,0.3159942077050888,0.4231239512929116,0,0,1.776593823370056,2.046691861769839,PPIA;GAPDH,9
GO_Biological_Process_2023,Positive Regulation Of Response To Stimulus (GO:0048584),1/77,0.3207065055587057,0.4242599314499504,0,0,2.6347687400318978,2.996335121708695,RPS3,9
GO_Biological_Process_2023,Neutrophil Migration (GO:1990266),1/77,0.3207065055587057,0.4242599314499504,0,0,2.6347687400318978,2.996335121708695,PPIA,9
GO_Biological_Process_2023,Monoatomic Cation Homeostasis (GO:0055080),1/77,0.3207065055587057,0.4242599314499504,0,0,2.6347687400318978,2.996335121708695,MT3,9
GO_Biological_Process_2023,Negative Regulation Of Blood Vessel Morphogenesis (GO:2000181),1/77,0.3207065055587057,0.4242599314499504,0,0,2.6347687400318978,2.996335121708695,SPARC,9
GO_Biological_Process_2023,Embryonic Organ Development (GO:0048568),1/77,0.3207065055587057,0.4242599314499504,0,0,2.6347687400318978,2.996335121708695,RPL10,9
GO_Biological_Process_2023,Positive Regulation Of Phosphorylation (GO:0042327),2/231,0.3215064257532412,0.4242957397560803,0,0,1.753052312628108,1.9892546346084377,PPIA;MT3,9
GO_Biological_Process_2023,Negative Regulation Of Protein Modification Process (GO:0031400),1/78,0.3241160944299128,0.4267139948249931,0,0,2.600419782237964,2.929772078325152,PPIA,9
GO_Biological_Process_2023,Positive Regulation Of Protein Modification By Small Protein Conjugation Or Removal (GO:1903322),1/79,0.3275087398015298,0.4270838435891683,0,0,2.566951566951567,2.865335397718705,UBB,9
GO_Biological_Process_2023,Protein Import Into Nucleus (GO:0006606),1/79,0.3275087398015298,0.4270838435891683,0,0,2.566951566951567,2.865335397718705,RPL17,9
GO_Biological_Process_2023,Cellular Response To UV (GO:0034644),1/79,0.3275087398015298,0.4270838435891683,0,0,2.566951566951567,2.865335397718705,RPL26,9
GO_Biological_Process_2023,Positive Regulation Of Endocytosis (GO:0045807),1/79,0.3275087398015298,0.4270838435891683,0,0,2.566951566951567,2.865335397718705,APOE,9
GO_Biological_Process_2023,Response To Type II Interferon (GO:0034341),1/80,0.3308845249727721,0.4304635170854309,0,0,2.534330648254699,2.8029337896230078,GAPDH,9
GO_Biological_Process_2023,Regulation Of Gene Expression (GO:0010468),7/1127,0.3333663024528846,0.4326669031835311,0,0,1.2620967741935485,1.38643020113204,RPS7;RPL11;RPS3;APOE;MT3;RPL17;RPL6,9
GO_Biological_Process_2023,Spindle Assembly (GO:0051225),1/81,0.3342435328543524,0.4327823102288667,0,0,2.5025252525252526,2.742480915944007,RPS3,9
GO_Biological_Process_2023,Regulation Of Cell Population Proliferation (GO:0042127),5/766,0.337208055516819,0.4355934646558438,0,0,1.323673836364894,1.4389064788839827,RPS4X;RPS9;RPS15A;RPS6;RPL17,9
GO_Biological_Process_2023,Regulation Of NIK/NF-kappaB Signaling (GO:1901222),1/83,0.3409115467213686,0.439343753873313,0,0,2.4412416851441243,2.627098856469418,RPS3,9
