Gene_set,Term,Overlap,P-value,Adjusted P-value,Old P-value,Old Adjusted P-value,Odds Ratio,Combined Score,Genes,cluster
GO_Biological_Process_2023,Regulation Of Amyloid Precursor Protein Catabolic Process (GO:1902991),1/11,0.0536582567508638,0.2283595578001879,0,0,20.09090909090909,58.76831842188268,APOE,9
GO_Biological_Process_2023,Defense Response To Gram-negative Bacterium (GO:0050829),2/75,0.0542668897312265,0.229173249711103,0,0,5.542913055633212,16.15116734069409,RPL30;RPS19,9
GO_Biological_Process_2023,Positive Regulation Of Protein Secretion (GO:0050714),2/76,0.0555565913641185,0.2328287683885578,0,0,5.467733039161611,15.803679213614178,NNAT;PPIA,9
GO_Biological_Process_2023,Proteolysis Involved In Protein Catabolic Process (GO:0051603),2/78,0.058168160710821,0.2410339448155146,0,0,5.323308270676692,15.141709290687697,UBB;RPS27A,9
GO_Biological_Process_2023,Negative Regulation Of Coagulation (GO:0050819),1/12,0.0583925585800791,0.2410339448155146,0,0,18.26354453627181,51.878818604154176,APOE,9
GO_Biological_Process_2023,Negative Regulation Of Protein Serine/Threonine Kinase Activity (GO:0071901),2/80,0.0608217071927091,0.245700519423763,0,0,5.186289900575615,14.520618689888993,UCHL1;APOE,9
GO_Biological_Process_2023,Activation Of Protein Kinase Activity (GO:0032147),2/81,0.0621638842786596,0.245700519423763,0,0,5.120382330147248,14.224325268693594,PPIA;MT3,9
GO_Biological_Process_2023,Regulation Of Intrinsic Apoptotic Signaling Pathway In Response To DNA Damage By P53 Class Mediator (GO:1902165),1/13,0.0631034120924418,0.245700519423763,0,0,16.74074074074074,46.254339159717055,RPL26,9
GO_Biological_Process_2023,Killing By Host Of Symbiont Cells (GO:0051873),1/13,0.0631034120924418,0.245700519423763,0,0,16.74074074074074,46.254339159717055,GAPDH,9
GO_Biological_Process_2023,Regulation Of Nitrogen Compound Metabolic Process (GO:0051171),1/13,0.0631034120924418,0.245700519423763,0,0,16.74074074074074,46.254339159717055,APOE,9
GO_Biological_Process_2023,Regulation Of Oxidoreductase Activity (GO:0051341),1/13,0.0631034120924418,0.245700519423763,0,0,16.74074074074074,46.254339159717055,MT3,9
GO_Biological_Process_2023,Positive Regulation Of T Cell Receptor Signaling Pathway (GO:0050862),1/13,0.0631034120924418,0.245700519423763,0,0,16.74074074074074,46.254339159717055,RPS3,9
GO_Biological_Process_2023,"Endonucleolytic Cleavage Of Tricistronic rRNA Transcript (SSU-rRNA, 5.8S rRNA, LSU-rRNA) (GO:0000479)",1/13,0.0631034120924418,0.245700519423763,0,0,16.74074074074074,46.254339159717055,RPS21,9
GO_Biological_Process_2023,Positive Regulation Of Protein Ubiquitination (GO:0031398),2/84,0.0662504359060044,0.251467714597765,0,0,4.9323046291687405,13.387819731164344,UBB;RPS2,9
GO_Biological_Process_2023,Positive Regulation Of Amide Metabolic Process (GO:0034250),2/85,0.067632189652766,0.251467714597765,0,0,4.87263339070568,13.12527238363094,RPS4X;RPL26,9
GO_Biological_Process_2023,Defense Response To Gram-positive Bacterium (GO:0050830),2/85,0.067632189652766,0.251467714597765,0,0,4.87263339070568,13.12527238363094,FAU;RPL39,9
GO_Biological_Process_2023,Regulation Of Extracellular Matrix Disassembly (GO:0010715),1/14,0.0677909321684321,0.251467714597765,0,0,15.452214452214452,41.58695944336839,CST3,9
GO_Biological_Process_2023,Positive Regulation Of Membrane Protein Ectodomain Proteolysis (GO:0051044),1/14,0.0677909321684321,0.251467714597765,0,0,15.452214452214452,41.58695944336839,APOE,9
GO_Biological_Process_2023,Lipoprotein Biosynthetic Process (GO:0042158),1/14,0.0677909321684321,0.251467714597765,0,0,15.452214452214452,41.58695944336839,APOE,9
GO_Biological_Process_2023,Mitochondrion Transport Along Microtubule (GO:0047497),1/14,0.0677909321684321,0.251467714597765,0,0,15.452214452214452,41.58695944336839,UBB,9
GO_Biological_Process_2023,Regulation Of Endothelial Cell Migration (GO:0010594),2/88,0.071834354272908,0.2533625669643726,0,0,4.701945894636925,12.382068798517093,SPARC;APOE,9
GO_Biological_Process_2023,Negative Regulation Of Neuron Death (GO:1901215),2/88,0.071834354272908,0.2533625669643726,0,0,4.701945894636925,12.382068798517093,APOE;MT3,9
GO_Biological_Process_2023,Regulation Of Cholesterol Biosynthetic Process (GO:0045540),1/15,0.0724552331756038,0.2533625669643726,0,0,14.347763347763347,37.6598138369901,APOE,9
GO_Biological_Process_2023,Negative Regulation Of Immune Effector Process (GO:0002698),1/15,0.0724552331756038,0.2533625669643726,0,0,14.347763347763347,37.6598138369901,RPS19,9
GO_Biological_Process_2023,Negative Regulation Of Platelet Activation (GO:0010544),1/15,0.0724552331756038,0.2533625669643726,0,0,14.347763347763347,37.6598138369901,APOE,9
GO_Biological_Process_2023,Regulation Of Intrinsic Apoptotic Signaling Pathway In Response To DNA Damage (GO:1902229),1/15,0.0724552331756038,0.2533625669643726,0,0,14.347763347763347,37.6598138369901,RPS3,9
GO_Biological_Process_2023,High-Density Lipoprotein Particle Remodeling (GO:0034375),1/15,0.0724552331756038,0.2533625669643726,0,0,14.347763347763347,37.6598138369901,APOE,9
GO_Biological_Process_2023,"Positive Regulation Of DNA Damage Response, Signal Transduction By P53 Class Mediator (GO:0043517)",1/15,0.0724552331756038,0.2533625669643726,0,0,14.347763347763347,37.6598138369901,RPL26,9
GO_Biological_Process_2023,Regulation Of Amyloid-Beta Clearance (GO:1900221),1/15,0.0724552331756038,0.2533625669643726,0,0,14.347763347763347,37.6598138369901,APOE,9
GO_Biological_Process_2023,Positive Regulation Of Protein Metabolic Process (GO:0051247),3/196,0.0752869536183818,0.2596683403858512,0,0,3.1580043801079003,8.168015432674538,RPS4X;RPL26;APOE,9
GO_Biological_Process_2023,Positive Regulation Of Binding (GO:0051099),2/91,0.0761192182371278,0.2596683403858512,0,0,4.542765420775051,11.699685676018186,RPL11;APOE,9
GO_Biological_Process_2023,"Synaptic Transmission, Cholinergic (GO:0007271)",1/16,0.0770964289305897,0.2596683403858512,0,0,13.390572390572393,34.31599732708391,APOE,9
GO_Biological_Process_2023,Cellular Response To Gamma Radiation (GO:0071480),1/16,0.0770964289305897,0.2596683403858512,0,0,13.390572390572393,34.31599732708391,RPL26,9
GO_Biological_Process_2023,Negative Regulation Of Amyloid-Beta Formation (GO:1902430),1/16,0.0770964289305897,0.2596683403858512,0,0,13.390572390572393,34.31599732708391,APOE,9
GO_Biological_Process_2023,Reverse Cholesterol Transport (GO:0043691),1/16,0.0770964289305897,0.2596683403858512,0,0,13.390572390572393,34.31599732708391,APOE,9
GO_Biological_Process_2023,Regulation Of Endothelial Cell Proliferation (GO:0001936),2/93,0.0790200821692442,0.2621253302333318,0,0,4.442475891455484,11.27524039277228,SPARC;APOE,9
GO_Biological_Process_2023,"DNA Damage Response, Signal Transduction By P53 Class Mediator Resulting In Cell Cycle Arrest (GO:0006977)",1/17,0.0817146326715556,0.2621253302333318,0,0,12.553030303030305,31.43934295429433,RPL26,9
GO_Biological_Process_2023,Negative Regulation Of Oxidative Stress-Induced Intrinsic Apoptotic Signaling Pathway (GO:1902176),1/17,0.0817146326715556,0.2621253302333318,0,0,12.553030303030305,31.43934295429433,PPIA,9
GO_Biological_Process_2023,Positive Regulation Of Nitric-Oxide Synthase Activity (GO:0051000),1/17,0.0817146326715556,0.2621253302333318,0,0,12.553030303030305,31.43934295429433,APOE,9
GO_Biological_Process_2023,Amyloid Precursor Protein Metabolic Process (GO:0042982),1/17,0.0817146326715556,0.2621253302333318,0,0,12.553030303030305,31.43934295429433,APOE,9
GO_Biological_Process_2023,Intracellular Zinc Ion Homeostasis (GO:0006882),1/17,0.0817146326715556,0.2621253302333318,0,0,12.553030303030305,31.43934295429433,MT3,9
GO_Biological_Process_2023,Positive Regulation By Host Of Viral Process (GO:0044794),1/17,0.0817146326715556,0.2621253302333318,0,0,12.553030303030305,31.43934295429433,EEF1A1,9
GO_Biological_Process_2023,Regulation Of Macroautophagy (GO:0016241),2/96,0.0834353800745875,0.2621253302333318,0,0,4.300043421623969,10.679944049183517,UCHL1;GAPDH,9
GO_Biological_Process_2023,Positive Regulation Of Supramolecular Fiber Organization (GO:1902905),2/96,0.0834353800745875,0.2621253302333318,0,0,4.300043421623969,10.679944049183517,RPS3;APOE,9
GO_Biological_Process_2023,Regulation Of Protein Metabolic Process (GO:0051246),2/96,0.0834353800745875,0.2621253302333318,0,0,4.300043421623969,10.679944049183517,RPL10;APOE,9
GO_Biological_Process_2023,Positive Regulation Of Nervous System Process (GO:0031646),1/18,0.0863099571505927,0.2621253302333318,0,0,11.81402257872846,28.942114306609312,HCRT,9
GO_Biological_Process_2023,Nitric Oxide Mediated Signal Transduction (GO:0007263),1/18,0.0863099571505927,0.2621253302333318,0,0,11.81402257872846,28.942114306609312,APOE,9
GO_Biological_Process_2023,Regulation Of Oxidative Stress-Induced Intrinsic Apoptotic Signaling Pathway (GO:1902175),1/18,0.0863099571505927,0.2621253302333318,0,0,11.81402257872846,28.942114306609312,PPIA,9
GO_Biological_Process_2023,Regulation Of Protein Neddylation (GO:2000434),1/18,0.0863099571505927,0.2621253302333318,0,0,11.81402257872846,28.942114306609312,RPL11,9
GO_Biological_Process_2023,Negative Regulation Of Amyloid Precursor Protein Catabolic Process (GO:1902992),1/18,0.0863099571505927,0.2621253302333318,0,0,11.81402257872846,28.942114306609312,APOE,9
GO_Biological_Process_2023,Energy Reserve Metabolic Process (GO:0006112),1/18,0.0863099571505927,0.2621253302333318,0,0,11.81402257872846,28.942114306609312,MT3,9
GO_Biological_Process_2023,Negative Regulation Of Macromolecule Biosynthetic Process (GO:0010558),2/98,0.0864201908419545,0.2621253302333318,0,0,4.210034013605442,10.308411171595903,RPS3;GAPDH,9
GO_Biological_Process_2023,Positive Regulation Of Cold-Induced Thermogenesis (GO:0120162),2/98,0.0864201908419545,0.2621253302333318,0,0,4.210034013605442,10.308411171595903,GNAS;HCRT,9
GO_Biological_Process_2023,Glycogen Metabolic Process (GO:0005977),1/19,0.0908825145361798,0.266815510590175,0,0,11.15712682379349,26.75688382123247,GAA,9
GO_Biological_Process_2023,Heme Biosynthetic Process (GO:0006783),1/19,0.0908825145361798,0.266815510590175,0,0,11.15712682379349,26.75688382123247,HCRT,9
GO_Biological_Process_2023,Neuron Apoptotic Process (GO:0051402),1/19,0.0908825145361798,0.266815510590175,0,0,11.15712682379349,26.75688382123247,GAPDH,9
GO_Biological_Process_2023,Regulation Of Tissue Remodeling (GO:0034103),1/19,0.0908825145361798,0.266815510590175,0,0,11.15712682379349,26.75688382123247,CST3,9
GO_Biological_Process_2023,Positive Regulation Of Activated T Cell Proliferation (GO:0042104),1/19,0.0908825145361798,0.266815510590175,0,0,11.15712682379349,26.75688382123247,RPS3,9
GO_Biological_Process_2023,Regulation Of Behavior (GO:0050795),1/19,0.0908825145361798,0.266815510590175,0,0,11.15712682379349,26.75688382123247,APOE,9
GO_Biological_Process_2023,Regulation Of Protein Secretion (GO:0050708),2/102,0.0924846891098034,0.2686460016999051,0,0,4.040816326530612,9.62002061056518,APOE;PPIA,9
GO_Biological_Process_2023,Regulation Of RNA Splicing (GO:0043484),2/102,0.0924846891098034,0.2686460016999051,0,0,4.040816326530612,9.62002061056518,RPS26;RPS13,9
GO_Biological_Process_2023,Positive Regulation Of Cell Population Proliferation (GO:0008284),5/483,0.0947849985378782,0.2686789571174478,0,0,2.1385157454305217,5.038651310915904,RPS4X;RPS9;RPS15A;RPS6;RPL17,9
GO_Biological_Process_2023,Negative Regulation Of Viral Life Cycle (GO:1903901),1/20,0.0954324164624814,0.2686789571174478,0,0,10.569377990430622,24.83103038927071,PPIA,9
GO_Biological_Process_2023,Intracellular Monoatomic Ion Homeostasis (GO:0006873),1/20,0.0954324164624814,0.2686789571174478,0,0,10.569377990430622,24.83103038927071,MT3,9
GO_Biological_Process_2023,Cellular Response To Copper Ion (GO:0071280),1/20,0.0954324164624814,0.2686789571174478,0,0,10.569377990430622,24.83103038927071,MT3,9
GO_Biological_Process_2023,protein-DNA Complex Disassembly (GO:0032986),1/20,0.0954324164624814,0.2686789571174478,0,0,10.569377990430622,24.83103038927071,RPL17,9
GO_Biological_Process_2023,Positive Regulation Of Antigen Receptor-Mediated Signaling Pathway (GO:0050857),1/20,0.0954324164624814,0.2686789571174478,0,0,10.569377990430622,24.83103038927071,RPS3,9
GO_Biological_Process_2023,Negative Regulation Of Reactive Oxygen Species Metabolic Process (GO:2000378),1/21,0.0999597740324998,0.2695273518873687,0,0,10.04040404040404,23.1229243332888,MT3,9
GO_Biological_Process_2023,Regulation Of Membrane Protein Ectodomain Proteolysis (GO:0051043),1/21,0.0999597740324998,0.2695273518873687,0,0,10.04040404040404,23.1229243332888,APOE,9
GO_Biological_Process_2023,Regulation Of Neurotransmitter Transport (GO:0051588),1/21,0.0999597740324998,0.2695273518873687,0,0,10.04040404040404,23.1229243332888,HCRT,9
GO_Biological_Process_2023,"Maturation Of 5.8S rRNA From Tricistronic rRNA Transcript (SSU-rRNA, 5.8S rRNA, LSU-rRNA) (GO:0000466)",1/21,0.0999597740324998,0.2695273518873687,0,0,10.04040404040404,23.1229243332888,RPS21,9
GO_Biological_Process_2023,Regulation Of Steroid Metabolic Process (GO:0019218),1/21,0.0999597740324998,0.2695273518873687,0,0,10.04040404040404,23.1229243332888,APOE,9
GO_Biological_Process_2023,Porphyrin-Containing Compound Biosynthetic Process (GO:0006779),1/21,0.0999597740324998,0.2695273518873687,0,0,10.04040404040404,23.1229243332888,HCRT,9
GO_Biological_Process_2023,Modulation By Host Of Viral Genome Replication (GO:0044827),1/21,0.0999597740324998,0.2695273518873687,0,0,10.04040404040404,23.1229243332888,EEF1A1,9
GO_Biological_Process_2023,Negative Regulation Of Translation (GO:0017148),2/107,0.1002338670046704,0.2695273518873687,0,0,3.847424684159378,8.850035372430577,RPS3;GAPDH,9
GO_Biological_Process_2023,Positive Regulation Of Metabolic Process (GO:0009893),2/108,0.1018050719773058,0.2695273518873687,0,0,3.81093569503273,8.70682707358352,GNAS;HCRT,9
GO_Biological_Process_2023,Positive Regulation Of Translation (GO:0045727),2/108,0.1018050719773058,0.2695273518873687,0,0,3.81093569503273,8.70682707358352,RPS4X;RPL26,9
GO_Biological_Process_2023,Acetylcholine Receptor Signaling Pathway (GO:0095500),1/22,0.104464697819105,0.2695273518873687,0,0,9.561808561808562,21.59922753970687,LY6H,9
GO_Biological_Process_2023,Protein Peptidyl-Prolyl Isomerization (GO:0000413),1/22,0.104464697819105,0.2695273518873687,0,0,9.561808561808562,21.59922753970687,PPIA,9
GO_Biological_Process_2023,Regulation Of Vascular Endothelial Growth Factor Receptor Signaling Pathway (GO:0030947),1/22,0.104464697819105,0.2695273518873687,0,0,9.561808561808562,21.59922753970687,MT3,9
GO_Biological_Process_2023,Response To Gamma Radiation (GO:0010332),1/22,0.104464697819105,0.2695273518873687,0,0,9.561808561808562,21.59922753970687,RPL26,9
GO_Biological_Process_2023,Cytoskeleton-Dependent Intracellular Transport (GO:0030705),1/22,0.104464697819105,0.2695273518873687,0,0,9.561808561808562,21.59922753970687,TUBA1B,9
GO_Biological_Process_2023,Negative Regulation Of Axonogenesis (GO:0050771),1/22,0.104464697819105,0.2695273518873687,0,0,9.561808561808562,21.59922753970687,MT3,9
GO_Biological_Process_2023,Positive Regulation Of Cholesterol Efflux (GO:0010875),1/22,0.104464697819105,0.2695273518873687,0,0,9.561808561808562,21.59922753970687,APOE,9
GO_Biological_Process_2023,Negative Regulation Of Inflammatory Response (GO:0050728),2/111,0.1065594896807097,0.2695273518873687,0,0,3.705485864070399,8.296775020722748,RPS19;APOE,9
GO_Biological_Process_2023,Regulation Of Cholesterol Metabolic Process (GO:0090181),1/23,0.1089472978360328,0.2695273518873687,0,0,9.1267217630854,20.232947516534363,APOE,9
GO_Biological_Process_2023,Negative Regulation Of Oxidative Stress-Induced Cell Death (GO:1903202),1/23,0.1089472978360328,0.2695273518873687,0,0,9.1267217630854,20.232947516534363,PPIA,9
GO_Biological_Process_2023,Zinc Ion Transport (GO:0006829),1/23,0.1089472978360328,0.2695273518873687,0,0,9.1267217630854,20.232947516534363,MT3,9
GO_Biological_Process_2023,Long-Chain Fatty Acid Transport (GO:0015909),1/23,0.1089472978360328,0.2695273518873687,0,0,9.1267217630854,20.232947516534363,APOE,9
GO_Biological_Process_2023,Cholesterol Efflux (GO:0033344),1/23,0.1089472978360328,0.2695273518873687,0,0,9.1267217630854,20.232947516534363,APOE,9
GO_Biological_Process_2023,Negative Regulation Of Actin Filament Polymerization (GO:0030837),1/23,0.1089472978360328,0.2695273518873687,0,0,9.1267217630854,20.232947516534363,TMSB10,9
GO_Biological_Process_2023,Regulation Of Protein Ubiquitination (GO:0031396),2/113,0.109762052329387,0.2695273518873687,0,0,3.638352638352639,8.038723369904124,UBB;RPS3,9
GO_Biological_Process_2023,Positive Regulation Of Cellular Component Organization (GO:0051130),2/113,0.109762052329387,0.2695273518873687,0,0,3.638352638352639,8.038723369904124,RPS3;APOE,9
GO_Biological_Process_2023,Regulation Of MAP Kinase Activity (GO:0043405),2/114,0.1113729080000625,0.2695273518873687,0,0,3.6056851311953353,7.914014366919983,UCHL1;APOE,9
GO_Biological_Process_2023,Stress Granule Assembly (GO:0034063),1/24,0.113407683581024,0.2695273518873687,0,0,8.729468599033817,19.002011610155247,RPS23,9
GO_Biological_Process_2023,ERK1 And ERK2 Cascade (GO:0070371),1/24,0.113407683581024,0.2695273518873687,0,0,8.729468599033817,19.002011610155247,MT3,9
GO_Biological_Process_2023,Positive Regulation Of Lipid Metabolic Process (GO:0045834),1/24,0.113407683581024,0.2695273518873687,0,0,8.729468599033817,19.002011610155247,APOE,9
GO_Biological_Process_2023,Acylglycerol Homeostasis (GO:0055090),1/24,0.113407683581024,0.2695273518873687,0,0,8.729468599033817,19.002011610155247,APOE,9
GO_Biological_Process_2023,Regulation Of Proteolysis Involved In Protein Catabolic Process (GO:1903050),1/24,0.113407683581024,0.2695273518873687,0,0,8.729468599033817,19.002011610155247,UBB,9
GO_Biological_Process_2023,Protein Kinase B Signaling (GO:0043491),1/24,0.113407683581024,0.2695273518873687,0,0,8.729468599033817,19.002011610155247,MT3,9
GO_Biological_Process_2023,Regulation Of Supramolecular Fiber Organization (GO:1902903),1/24,0.113407683581024,0.2695273518873687,0,0,8.729468599033817,19.002011610155247,APOE,9
GO_Biological_Process_2023,Regulation Of Viral Life Cycle (GO:1903900),1/24,0.113407683581024,0.2695273518873687,0,0,8.729468599033817,19.002011610155247,PPIA,9
GO_Biological_Process_2023,Response To Copper Ion (GO:0046688),1/24,0.113407683581024,0.2695273518873687,0,0,8.729468599033817,19.002011610155247,MT3,9
GO_Biological_Process_2023,Positive Regulation Of Interleukin-2 Production (GO:0032743),1/25,0.1178459640404217,0.2762221150129192,0,0,8.365319865319865,17.88820673407011,RPS3,9
GO_Biological_Process_2023,Negative Regulation Of Protein Transport (GO:0051224),1/25,0.1178459640404217,0.2762221150129192,0,0,8.365319865319865,17.88820673407011,APOE,9
GO_Biological_Process_2023,Mitotic Cell Cycle Checkpoint Signaling (GO:0007093),1/25,0.1178459640404217,0.2762221150129192,0,0,8.365319865319865,17.88820673407011,ZWINT,9
GO_Biological_Process_2023,Regulation Of Protein-Containing Complex Assembly (GO:0043254),2/119,0.1195188772922953,0.2762221150129192,0,0,3.450723879295308,7.330307004338375,RPS3;APOE,9
GO_Biological_Process_2023,Regulation Of Autophagy (GO:0010506),3/241,0.1201026684674798,0.2762221150129192,0,0,2.5550550116954,5.415204879048252,EEF1A1;UCHL1;GAPDH,9
GO_Biological_Process_2023,Spindle Assembly Checkpoint Signaling (GO:0071173),1/26,0.1222622476286691,0.2762221150129192,0,0,8.030303030303031,16.876380218002918,ZWINT,9
GO_Biological_Process_2023,Positive Regulation Of Microtubule Polymerization Or Depolymerization (GO:0031112),1/26,0.1222622476286691,0.2762221150129192,0,0,8.030303030303031,16.876380218002918,RPS3,9
GO_Biological_Process_2023,Positive Regulation Of Monooxygenase Activity (GO:0032770),1/26,0.1222622476286691,0.2762221150129192,0,0,8.030303030303031,16.876380218002918,APOE,9
GO_Biological_Process_2023,Mitotic G1 DNA Damage Checkpoint Signaling (GO:0031571),1/26,0.1222622476286691,0.2762221150129192,0,0,8.030303030303031,16.876380218002918,RPL26,9
GO_Biological_Process_2023,Mitotic Spindle Assembly Checkpoint Signaling (GO:0007094),1/26,0.1222622476286691,0.2762221150129192,0,0,8.030303030303031,16.876380218002918,ZWINT,9
GO_Biological_Process_2023,Mitotic Spindle Checkpoint Signaling (GO:0071174),1/26,0.1222622476286691,0.2762221150129192,0,0,8.030303030303031,16.876380218002918,ZWINT,9
GO_Biological_Process_2023,Negative Regulation Of Catalytic Activity (GO:0043086),1/26,0.1222622476286691,0.2762221150129192,0,0,8.030303030303031,16.876380218002918,MT3,9
GO_Biological_Process_2023,Positive Regulation Of Macromolecule Biosynthetic Process (GO:0010557),2/122,0.1244762469056777,0.2800715555377748,0,0,3.3639455782312924,7.0092528065471456,RPS4X;RPL26,9
GO_Biological_Process_2023,Positive Regulation Of Ubiquitin-Protein Transferase Activity (GO:0051443),1/27,0.1266566423028266,0.280381034775209,0,0,7.721056721056721,15.953830010816358,RPS2,9
GO_Biological_Process_2023,Regulation Of Peptidase Activity (GO:0052547),1/27,0.1266566423028266,0.280381034775209,0,0,7.721056721056721,15.953830010816358,CST3,9
GO_Biological_Process_2023,Peptidyl-Proline Modification (GO:0018208),1/27,0.1266566423028266,0.280381034775209,0,0,7.721056721056721,15.953830010816358,PPIA,9
GO_Biological_Process_2023,Cellular Response To Epidermal Growth Factor Stimulus (GO:0071364),1/27,0.1266566423028266,0.280381034775209,0,0,7.721056721056721,15.953830010816358,EEF1A1,9
GO_Biological_Process_2023,Negative Regulation Of Mitotic Metaphase/Anaphase Transition (GO:0045841),1/28,0.1310292553948657,0.2847652352822101,0,0,7.434717545828657,15.109834134055738,ZWINT,9
GO_Biological_Process_2023,Regulation Of Lipid Biosynthetic Process (GO:0046890),1/28,0.1310292553948657,0.2847652352822101,0,0,7.434717545828657,15.109834134055738,APOE,9
GO_Biological_Process_2023,Negative Regulation Of Wound Healing (GO:0061045),1/28,0.1310292553948657,0.2847652352822101,0,0,7.434717545828657,15.109834134055738,APOE,9
GO_Biological_Process_2023,Regulation Of Nitric-Oxide Synthase Activity (GO:0050999),1/28,0.1310292553948657,0.2847652352822101,0,0,7.434717545828657,15.109834134055738,APOE,9
GO_Biological_Process_2023,Regulation Of Developmental Growth (GO:0048638),1/29,0.13538019382269,0.2847652352822101,0,0,7.1688311688311686,14.335283778329618,APOE,9
GO_Biological_Process_2023,Positive Regulation Of Microtubule Polymerization (GO:0031116),1/29,0.13538019382269,0.2847652352822101,0,0,7.1688311688311686,14.335283778329618,RPS3,9
GO_Biological_Process_2023,Glycolytic Process (GO:0006096),1/29,0.13538019382269,0.2847652352822101,0,0,7.1688311688311686,14.335283778329618,GAPDH,9
GO_Biological_Process_2023,TOR Signaling (GO:0031929),1/29,0.13538019382269,0.2847652352822101,0,0,7.1688311688311686,14.335283778329618,RPS6,9
GO_Biological_Process_2023,Positive Regulation Of Viral Genome Replication (GO:0045070),1/29,0.13538019382269,0.2847652352822101,0,0,7.1688311688311686,14.335283778329618,PPIA,9
GO_Biological_Process_2023,Lipid Droplet Organization (GO:0034389),1/29,0.13538019382269,0.2847652352822101,0,0,7.1688311688311686,14.335283778329618,PPIA,9
GO_Biological_Process_2023,Defense Response To Fungus (GO:0050832),1/29,0.13538019382269,0.2847652352822101,0,0,7.1688311688311686,14.335283778329618,GAPDH,9
GO_Biological_Process_2023,Regulation Of Blood Coagulation (GO:0030193),1/29,0.13538019382269,0.2847652352822101,0,0,7.1688311688311686,14.335283778329618,APOE,9
GO_Biological_Process_2023,Positive Regulation Of Dephosphorylation (GO:0035306),1/29,0.13538019382269,0.2847652352822101,0,0,7.1688311688311686,14.335283778329618,PPIA,9
GO_Biological_Process_2023,Positive Regulation Of JUN Kinase Activity (GO:0043507),1/30,0.1397095639188418,0.2883479345543014,0,0,6.921281783350749,13.622394510819325,RPS3,9
GO_Biological_Process_2023,Response To Epidermal Growth Factor (GO:0070849),1/30,0.1397095639188418,0.2883479345543014,0,0,6.921281783350749,13.622394510819325,EEF1A1,9
GO_Biological_Process_2023,Positive Regulation Of Cell Communication (GO:0010647),1/30,0.1397095639188418,0.2883479345543014,0,0,6.921281783350749,13.622394510819325,HCRT,9
GO_Biological_Process_2023,Negative Regulation Of Axon Extension (GO:0030517),1/30,0.1397095639188418,0.2883479345543014,0,0,6.921281783350749,13.622394510819325,MT3,9
GO_Biological_Process_2023,Negative Regulation Of Blood Coagulation (GO:0030195),1/30,0.1397095639188418,0.2883479345543014,0,0,6.921281783350749,13.622394510819325,APOE,9
GO_Biological_Process_2023,Regulation Of Apoptotic Process (GO:0042981),6/705,0.1416299768709821,0.2906823229934554,0,0,1.7533558579125197,3.426999633221168,UBB;RPL10;RPS6;RPS3;PPIA;MT3,9
GO_Biological_Process_2023,Negative Regulation Of Developmental Growth (GO:0048640),1/31,0.1440174715013112,0.2906823229934554,0,0,6.69023569023569,12.964476920040203,MT3,9
GO_Biological_Process_2023,Triglyceride Homeostasis (GO:0070328),1/31,0.1440174715013112,0.2906823229934554,0,0,6.69023569023569,12.964476920040203,APOE,9
GO_Biological_Process_2023,Regulation Of Long-Term Synaptic Potentiation (GO:1900271),1/31,0.1440174715013112,0.2906823229934554,0,0,6.69023569023569,12.964476920040203,APOE,9
GO_Biological_Process_2023,Positive Regulation Of Cholesterol Transport (GO:0032376),1/31,0.1440174715013112,0.2906823229934554,0,0,6.69023569023569,12.964476920040203,APOE,9
GO_Biological_Process_2023,Regulation Of Cell Morphogenesis (GO:0022604),1/31,0.1440174715013112,0.2906823229934554,0,0,6.69023569023569,12.964476920040203,SPARC,9
GO_Biological_Process_2023,Non-Membrane-Bounded Organelle Assembly (GO:0140694),2/135,0.146494146719129,0.2938966900998387,0,0,3.03314408470155,5.82597157350083,RPS3;RPS23,9
GO_Biological_Process_2023,Regulation Of Cholesterol Efflux (GO:0010874),1/32,0.1483040219339779,0.2938966900998387,0,0,6.474095796676441,12.355752978101908,APOE,9
GO_Biological_Process_2023,Transition Metal Ion Transport (GO:0000041),1/32,0.1483040219339779,0.2938966900998387,0,0,6.474095796676441,12.355752978101908,MT3,9
